{
  "$schema": "https://json-schema.org/draft/2020-12/schema",
  "title": "DirectMessageCollection",
  "type": "array",
  "items": {
    "type": "object",
    "additionalProperties": false,
    "required": ["id", "sender_id", "receiver_id", "content", "created_at"],
    "properties": {
      "id": { "type": "string" },
      "sender_id": { "type": "string" },
      "receiver_id": { "type": "string" },
      "content": { "type": "string" },
      "created_at": { "type": "string", "format": "date-time" }
    }
  }
}
