[
  {
    "id": "dm_001",
    "sender_id": "user_jiangfeng",
    "receiver_id": "demo_user",
    "content": "周六东湖早口活动我已经报名了，五点半入口见。",
    "created_at": "2026-06-13T10:10:00+00:00"
  },
  {
    "id": "dm_002",
    "sender_id": "demo_user",
    "receiver_id": "user_jiangfeng",
    "content": "收到，我带抄网和备用路亚竿。",
    "created_at": "2026-06-13T10:18:00+00:00"
  }
]
